{
  "$schema": "https://json-schema.org/draft/2020-12/schema",
  "$id": "https://heimgewebe.org/chronik/coding-memory-runtime-v1.schema.json",
  "title": "Chronik coding-memory runtime contract v1",
  "type": "object",
  "additionalProperties": false,
  "required": [
    "schema_version",
    "entrypoint",
    "requirements_source",
    "python",
    "required_distributions",
    "does_not_establish"
  ],
  "properties": {
    "schema_version": {
      "const": "chronik-coding-memory-runtime.v1"
    },
    "entrypoint": {
      "const": "tools/coding_memory.py"
    },
    "requirements_source": {
      "const": "requirements.txt"
    },
    "python": {
      "type": "object",
      "additionalProperties": false,
      "required": ["requires"],
      "properties": {
        "requires": {
          "type": "string",
          "minLength": 1
        }
      }
    },
    "required_distributions": {
      "type": "array",
      "minItems": 1,
      "items": {
        "type": "object",
        "additionalProperties": false,
        "required": ["distribution", "specifier", "imports"],
        "properties": {
          "distribution": {
            "type": "string",
            "pattern": "^[A-Za-z0-9][A-Za-z0-9._-]*$"
          },
          "specifier": {
            "type": "string",
            "minLength": 2
          },
          "imports": {
            "type": "array",
            "minItems": 1,
            "uniqueItems": true,
            "items": {
              "type": "string",
              "pattern": "^[A-Za-z_][A-Za-z0-9_]*$"
            }
          }
        }
      }
    },
    "does_not_establish": {
      "type": "array",
      "minItems": 1,
      "uniqueItems": true,
      "items": {
        "type": "string",
        "minLength": 1
      }
    }
  }
}
